{
  "id": "DEC-layla-system-one",
  "type": "Decision",
  "title": "Layla is a second TypeSafe System One model; one adapter covers Jev and Layla",
  "status": "locked",
  "text": "",
  "sources": [
    {
      "kind": "owner",
      "id": "Q3",
      "at": "2026-10-10T18"
    }
  ],
  "edges": [],
  "created": "2026-10-10T18:55Z",
  "updated": "2026-10-10T18:55Z"
}
