{
  "id": "DEC-clear-schemas-codes-token-efficiency",
  "type": "Decision",
  "title": "Clear schemas and status codes, token efficiency: every hand-off is a schema-validated record routed on code and kind, prose capped, and nothing is read or sent that a code already says",
  "status": "locked",
  "text": "Owner, 2026-10-11 18:37Z: 'CLEAR SCHEMAS AND STATUS CODES, token efficiency.' Binding: records carry code, kind, sha and attempt; routing never reads prose; notes stay under 240 chars; briefs point at files instead of pasting them; a seat reads only what its role needs.",
  "sources": [
    {
      "kind": "owner",
      "id": "chat-wD3-p2",
      "at": "2026-10-11T18"
    }
  ],
  "edges": [
    {
      "kind": "implements",
      "to": "REQ-north-star"
    },
    {
      "kind": "depends_on",
      "to": "DEC-system-runs-the-loop"
    }
  ],
  "created": "2026-10-11T18:36Z",
  "updated": "2026-10-11T18:36Z"
}
